{
  "entryFile": "./fixtures/express/server.ts",
  "noImplicitAdditionalProperties": "silently-remove-extras",
  "spec": {
    "outputDirectory": "./dist",
    "host": "localhost:3000",
    "basePath": "/v1",
    "yaml": true,
    "specVersion": 2
  },
  "routes": {
    "basePath": "/v1",
    "routesDir": "./fixtures/express",
    "middleware": "express"
  }
}
